泸州长江机械有限公司,MAGNA POWERTRAIN
德国大众汽车集团,山东玲珑轮胎股份有限公司
ENERCON GmbH,江苏振江新能源装备股份有限公司
东风雷诺汽车有限公司,桂林福达股份有限公司
中国核工业集团有限公司,天津银龙预应力材料股份有限公司
东方电气股份有限公司,东方锅炉股份有限公司
陕西投资集团有限公司,山西西山煤电贸易有限责任公司
河北养元智汇饮品股份有限公司,嘉美食品包装股份有限公司
南京轨道交通系统工程有限公司,南京恩瑞特实业有限公司
广东联泰环保股份有限公司,湖南省机械设备进出口公司
小米科技有限公司,广东力王高新科技股份有限公司
广汽三菱汽车有限公司,浙江嘉利（丽水）工业股份有限公司
东风雷诺汽车有限公司,浙江银轮机械股份有限公司
浙江吉利汽车零部件采购有限公司,浙江银轮机械股份有限公司
烽火通信科技股份有限公司,虎符智能科技股份有限公司
德国采埃孚（ZF）集团,深圳市凯中精密技术股份有限公司
一汽大众汽车有限公司,天津鹏翎集团股份有限公司
美国苹果公司,武汉精测电子技术股份有限公司
中国石油化工集团公司,河南环宇石化装备科技股份有限公司
北京车和家信息技术有限公司,安徽中鼎密封件股份有限公司
北京车和家信息技术有限公司,哈尔滨东安汽车动力股份有限公司
万科企业股份有限公司,山东雄狮建筑装饰股份有限公司
华为技术有限公司,广东力王高新科技股份有限公司
华夏银行股份有限公司,恒宝股份有限公司
一汽吉林汽车有限公司,浙江德宏汽车电子电器股份有限公司
中国交通建设股份有限公司,丰泽智能装备股份有限公司
中国核工业集团公司,深圳市沃尔核材股份有限公司
宁德时代新能源科技股份有限公司,安徽中鼎密封件股份有限公司
中国民生银行股份有限公司,广东英妮股份有限公司
中国工商银行股份有限公司,珠海汇金科技股份有限公司
万科企业股份有限公司,北京市金龙腾装饰股份有限公司
中国移动通信集团广东有限公司,广东莞银信息科技股份有限公司
中国银行股份有限公司,上海新世傲文化传播股份有限公司
华润燃气投资（中国）有限公司,新天科技股份有限公司
中国农业银行股份有限公司,恒宝股份有限公司
浙商银行股份有限公司,上海古鳌电子科技股份有限公司
交通银行股份有限公司,珠海汇金科技股份有限公司
中国民生银行股份有限公司,聚龙股份有限公司
海南省农村信用社联合社,广东德生科技股份有限公司
美国耐克公司,安徽安利材料科技股份有限公司
美国特斯拉,宁波拓普集团股份有限公司
华为技术有限公司,昆山迈致治具科技有限公司
恒力石化股份有限公司,吴江迈林贸易有限公司
恒力石化股份有限公司,苏州百莱贸易有限公司
恒力石化股份有限公司,苏州环峰贸易有限公司
唐山轨道客车有限责任公司,今创集团股份有限公司
今创集团股份有限公司,虎伯拉铰接系统(上海)有限公司
今创集团股份有限公司,江苏明伟万盛科技有限公司
河北养元智汇饮品股份有限公司,新疆西域乌敦农产品有限责任公司
河北养元智汇饮品股份有限公司,石家庄市德业工贸有限公司
河北养元智汇饮品股份有限公司,四川瑞晨农业开发有限公司
江苏国茂减速机股份有限公司,江苏盛安资源股份有限公司
江苏国茂减速机股份有限公司,常州国茂鑫鳌机械有限公司
江苏国茂减速机股份有限公司,常州市申品铸造有限公司
上海永冠众诚新材料科技（集团）股份有限公司,浙江金瑞薄膜材料有限公司
上海永冠众诚新材料科技（集团）股份有限公司,广州颁德化工科技有限公司
上海永冠众诚新材料科技（集团）股份有限公司,上海盈泰新材料科技有限公司
福莱特玻璃集团股份有限公司,国网浙江省电力公司
福莱特玻璃集团股份有限公司,宁波市镇海海湾石油化工有限公司
福莱特玻璃集团股份有限公司,江苏井神盐化股份有限公司
江苏丰山集团股份有限公司,应城市东诚有机硅有限公司
江苏丰山集团股份有限公司,山东中新科农公司
江苏丰山集团股份有限公司,浙江荣凯科技发展有限公司
金华春光橡塑科技股份有限公司,金华市新宏远线缆有限公司
金华春光橡塑科技股份有限公司,宁波和丰化工有限公司
金华春光橡塑科技股份有限公司,浙江三科线缆有限公司
亿嘉和科技股份有限公司,江苏电科电力工程有限公司
亿嘉和科技股份有限公司,杭州海康威视数字技术股份有限公司
亿嘉和科技股份有限公司,武汉高德智感科技有限公司
